{
  "id": "madinah",
  "type": "place",
  "names": { "en": "Medina", "ar": "المدينة المنورة", "ur": "مدینہ" },
  "alt_names": ["Madinah", "Madinah al-Munawwarah", "Yathrib", "المدينة", "يثرب"],
  "kind": "city",
  "geometry": { "type": "Point", "coordinates": [39.6142, 24.4672] },
  "gazetteer_ids": { "wikidata": "Q35484", "geonames": "109223" },
  "modern_name": { "en": "Medina", "ar": "المدينة المنورة" },
  "info": [
    { "kind": "text", "body": { "en": "Formerly Yathrib; destination of the Hijra and the first Islamic city-state." } }
  ],
  "sources": ["source:sealed-nectar"],
  "themes": ["seerah", "holy-sites"]
}
